<?xml version="1.0" encoding="utf-8"?>
<xs:schema xmlns:tns="urn:ndb:ett"
           targetNamespace="urn:ndb:ett"
           attributeFormDefault="unqualified"
           elementFormDefault="qualified"
           xmlns:xs="http://www.w3.org/2001/XMLSchema">
    <xs:element name="templates">
    <xs:complexType>
      <xs:sequence>
        <xs:element name="template" minOccurs="0" maxOccurs="unbounded">
          <xs:complexType mixed="true">
            <xs:sequence>
              <xs:element minOccurs="1" maxOccurs="unbounded" name="version" type="xs:string" />
            </xs:sequence>
            <xs:attribute name="name" type="xs:string" use="required" />
          </xs:complexType>
        </xs:element>
      </xs:sequence>
    </xs:complexType>
  </xs:element>
</xs:schema>